examples/cpp/llama/gemm_config.in
batch_size, seq_len, head_num, size_per_head dataType ### batchCount, n, m, k, algoId, customOption, tile, numSplitsK, swizzle, reductionScheme, workspaceSize, stages, exec_time
32 256 52 128 1 ### 1 19968 8192 6656 21 0 24 1 0 0 0 0 20.595835
32 256 52 128 1 ### 1664 256 256 128 103 -1 -1 -1 -1 -1 -1 -1 0.929050
32 256 52 128 1 ### 1664 128 256 256 103 -1 -1 -1 -1 -1 -1 -1 0.661050
32 256 52 128 1 ### 1 6656 8192 6656 21 0 24 1 0 0 0 0 6.882683
32 256 52 128 1 ### 1 17920 8192 6656 21 0 24 1 0 0 0 0 18.293156
32 256 52 128 1 ### 1 6656 8192 17920 21 0 24 2 0 1 6656 0 18.400911
32 1 52 128 1 ### 1 19968 32 6656 3 0 21 1 1 0 0 0 0.328397
32 1 52 128 1 ### 1 6656 32 6656 21 0 15 6 0 1 416 0 0.131215
32 1 52 128 1 ### 1 17920 32 6656 99 -1 -1 -1 -1 -1 -1 -1 0.306050
32 1 52 128 1 ### 1 6656 32 17920 21 0 15 6 0 1 416 0 0.312504
32 1 52 128 1 ### 1 32000 32 6656 99 -1 -1 -1 -1 -1 -1 -1 0.753770
